{
  "schema": "chimera-assurance-vector/v1",
  "observation": "UNKNOWN",
  "integrity": "SIGNED",
  "reproduction": "UNKNOWN",
  "provenance": "UNKNOWN",
  "authorization": "UNKNOWN",
  "independence": "UNKNOWN",
  "freshness": "UNKNOWN",
  "adversarial_coverage": "UNKNOWN",
  "formal_proof": "UNKNOWN",
  "implementation_binding": "UNKNOWN"
}
